{
  "schema_version": 1,
  "registry_id": "life-semantic-firewall-control-path-registry-v1",
  "runtime_control_authority": "NONE",
  "registry_authority": "SOURCE_VALIDATION_ONLY",
  "required_object_classes": [
    "GITHUB_ISSUE",
    "GITHUB_PULL_REQUEST",
    "ADMITTED_WORK_ITEM",
    "WORK_RECORD_INSTANCE",
    "RULE_SURFACE",
    "CLAIM_TRANSITION",
    "CONNECTED_APP_MUTATION",
    "RUNTIME_EFFECT",
    "CI_TRUST_ROOT"
  ],
  "protected_boundary_source": "governance/work-fence-policy.json:protected_boundaries",
  "semantic_firewall_work_item_id": "github-issue-57",
  "completion_gate": {
    "complete_requires_all_required_object_classes": true,
    "complete_requires_exact_protected_boundary_coverage": true,
    "complete_requires_unsafe_dynamic_sources_direct_control_forbidden": true,
    "complete_requires_class_states": {
      "RUNTIME_EFFECT": "RUNTIME_ACTIVE",
      "CI_TRUST_ROOT": "CI_ENFORCED_INDEPENDENT"
    }
  },
  "object_classes": [
    {
      "class_id": "GITHUB_ISSUE",
      "source_class": "GITHUB_ISSUE",
      "direct_control_effect": "FORBIDDEN",
      "canonical_bridge_paths": ["governance/work-admissions.json"],
      "instance_globs": [],
      "schema_path": null,
      "deterministic_consumer_paths": ["scripts/select_work.py", "scripts/validate_issue_lifecycle.py"],
      "fence_paths": ["scripts/evaluate_work_fence.py"],
      "authoritative_readback_requirements": ["GITHUB_ISSUE_STATE_AND_REASON_READBACK"],
      "decision_kinds": ["ROUTING", "PRIORITY", "STATE_TRANSITION", "COMPLETION"],
      "protected_boundaries": [],
      "enforcement_state": "CI_ENFORCED"
    },
    {
      "class_id": "GITHUB_PULL_REQUEST",
      "source_class": "GITHUB_PR",
      "direct_control_effect": "FORBIDDEN",
      "canonical_bridge_paths": ["coordination/schema/work-record.schema.json", "coordination/protocol.json"],
      "instance_globs": [],
      "schema_path": null,
      "deterministic_consumer_paths": ["scripts/validate_coordination.py", "scripts/evaluate_work_fence.py", ".github/workflows/continuity.yml"],
      "fence_paths": ["scripts/evaluate_work_fence.py"],
      "authoritative_readback_requirements": ["REQUIRED_VALIDATE_CHECK", "MERGE_GROUP_VALIDATE", "MERGED_MAIN_READBACK"],
      "decision_kinds": ["VERIFICATION", "STATE_TRANSITION", "MUTATION"],
      "protected_boundaries": ["PULL_REQUEST_VALIDATION", "MERGE_GROUP_VALIDATION"],
      "enforcement_state": "CI_ENFORCED"
    },
    {
      "class_id": "ADMITTED_WORK_ITEM",
      "source_class": "IMMUTABLE_REPOSITORY",
      "direct_control_effect": "DETERMINISTIC_BRIDGE_ONLY",
      "canonical_bridge_paths": ["governance/work-admissions.json", "governance/work-selection-policy.json"],
      "instance_globs": [],
      "schema_path": "governance/schema/work-admissions.schema.json",
      "deterministic_consumer_paths": ["scripts/select_work.py"],
      "fence_paths": ["scripts/evaluate_work_fence.py"],
      "authoritative_readback_requirements": [],
      "decision_kinds": ["ROUTING", "PRIORITY", "MUTATION"],
      "protected_boundaries": ["WORK_SELECTION_DISPATCH"],
      "enforcement_state": "CI_ENFORCED"
    },
    {
      "class_id": "WORK_RECORD_INSTANCE",
      "source_class": "IMMUTABLE_REPOSITORY",
      "direct_control_effect": "DETERMINISTIC_BRIDGE_ONLY",
      "canonical_bridge_paths": ["coordination/protocol.json"],
      "instance_globs": ["coordination/work/*.json"],
      "schema_path": "coordination/schema/work-record.schema.json",
      "deterministic_consumer_paths": ["scripts/validate_coordination.py", "scripts/evaluate_work_fence.py"],
      "fence_paths": ["scripts/evaluate_work_fence.py"],
      "authoritative_readback_requirements": ["LIVE_REQUIRED_LOCK_BRANCH_READBACK"],
      "decision_kinds": ["AUTHORIZATION", "ROUTING", "MUTATION"],
      "protected_boundaries": ["SOURCE_WORKSPACE_MUTATION"],
      "enforcement_state": "CI_ENFORCED"
    },
    {
      "class_id": "RULE_SURFACE",
      "source_class": "IMMUTABLE_REPOSITORY",
      "direct_control_effect": "DETERMINISTIC_BRIDGE_ONLY",
      "canonical_bridge_paths": ["contracts/semantic-firewall-v1/rule-registry.json", "contracts/semantic-firewall-v1/predicate-registry.json"],
      "instance_globs": [],
      "schema_path": "contracts/semantic-firewall-v1/predicate-registry.schema.json",
      "deterministic_consumer_paths": ["scripts/validate_semantic_firewall_conformance.py"],
      "fence_paths": [],
      "authoritative_readback_requirements": [],
      "decision_kinds": ["AUTHORIZATION", "ROUTING", "PRIORITY", "STATE_TRANSITION", "COMPLETION", "VERIFICATION", "ESCALATION", "RELEASE", "MUTATION", "EFFECT_EXECUTION"],
      "protected_boundaries": [],
      "enforcement_state": "CI_ENFORCED"
    },
    {
      "class_id": "CLAIM_TRANSITION",
      "source_class": "LIVE_GITHUB",
      "direct_control_effect": "DETERMINISTIC_BRIDGE_ONLY",
      "canonical_bridge_paths": ["coordination/protocol.json", "coordination/schema/lock.schema.json"],
      "instance_globs": [],
      "schema_path": "coordination/schema/lock.schema.json",
      "deterministic_consumer_paths": ["scripts/validate_coordination.py", "scripts/validate_relevant_lock_history.py", "scripts/evaluate_work_fence.py"],
      "fence_paths": ["scripts/evaluate_work_fence.py"],
      "authoritative_readback_requirements": ["LIVE_LOCK_BRANCH_READBACK"],
      "decision_kinds": ["AUTHORIZATION", "RELEASE", "MUTATION"],
      "protected_boundaries": ["CLAIM_RENEWAL"],
      "enforcement_state": "CI_ENFORCED"
    },
    {
      "class_id": "CONNECTED_APP_MUTATION",
      "source_class": "TOOL_REQUEST",
      "direct_control_effect": "DETERMINISTIC_BRIDGE_ONLY",
      "canonical_bridge_paths": ["governance/work-fence-policy.json", "scripts/evaluate_selected_operation_execution.py"],
      "instance_globs": [],
      "schema_path": null,
      "deterministic_consumer_paths": ["scripts/evaluate_selected_operation_execution.py", "scripts/evaluate_work_fence.py"],
      "fence_paths": ["scripts/evaluate_work_fence.py"],
      "authoritative_readback_requirements": ["TARGET_READBACK_AFTER_MUTATION"],
      "decision_kinds": ["AUTHORIZATION", "MUTATION", "EFFECT_EXECUTION"],
      "protected_boundaries": ["CONNECTED_APP_MUTATION"],
      "enforcement_state": "BOOTSTRAP_REQUIRED"
    },
    {
      "class_id": "RUNTIME_EFFECT",
      "source_class": "TOOL_REQUEST",
      "direct_control_effect": "FORBIDDEN_UNTIL_RUNTIME_ACTIVE",
      "canonical_bridge_paths": ["contracts/semantic-firewall-v1/spec.json", "scripts/evaluate_semantic_firewall_trusted_evidence.py"],
      "instance_globs": [],
      "schema_path": "contracts/semantic-firewall-v1/effect-request.schema.json",
      "deterministic_consumer_paths": ["scripts/evaluate_semantic_firewall_trusted_evidence.py"],
      "fence_paths": [],
      "authoritative_readback_requirements": ["PERSISTED_TRUSTED_EVIDENCE_RECEIPTS", "PERSISTED_TRUSTED_PASS_RECEIPT", "AUTHORITATIVE_POST_EFFECT_READBACK"],
      "decision_kinds": ["AUTHORIZATION", "VERIFICATION", "MUTATION", "EFFECT_EXECUTION"],
      "protected_boundaries": [],
      "enforcement_state": "SOURCE_ONLY_INACTIVE",
      "activation_dependencies": ["TRUSTED_EVIDENCE_BINDING_CONTRACT_IMPLEMENTED", "TRUSTED_EVIDENCE_ADAPTER_IMPLEMENTED", "PERSISTED_TRUSTED_EVIDENCE_RECEIPTS", "PERSISTED_TRUSTED_PASS_RECEIPT", "NON_BYPASS_EFFECT_ROUTING", "AUTHORITATIVE_POST_EFFECT_READBACK", "EXACT_LIFE_INVOKE_DEPLOYED_AND_VERIFIED"]
    },
    {
      "class_id": "CI_TRUST_ROOT",
      "source_class": "IMMUTABLE_REPOSITORY",
      "direct_control_effect": "FORBIDDEN_UNTIL_INDEPENDENT",
      "canonical_bridge_paths": [".github/workflows/continuity.yml"],
      "instance_globs": [],
      "schema_path": null,
      "deterministic_consumer_paths": [".github/workflows/continuity.yml"],
      "fence_paths": [],
      "authoritative_readback_requirements": ["INDEPENDENT_REQUIRED_CHECK_ON_PR_HEAD", "INDEPENDENT_REQUIRED_CHECK_ON_MERGE_GROUP"],
      "decision_kinds": ["VERIFICATION", "COMPLETION", "STATE_TRANSITION"],
      "protected_boundaries": [],
      "enforcement_state": "SOURCE_ONLY_INACTIVE",
      "activation_dependencies": ["BASE_OR_EXTERNAL_VERIFIER_NOT_CANDIDATE_CONTROLLED", "PROTECT_MAIN_REQUIRES_INDEPENDENT_GUARDIAN_CHECK", "MERGE_GROUP_GUARDIAN_EXECUTION"]
    }
  ]
}
